{
  "name": "covered_call_sol_perp_overlay",
  "underlying": "SOL",
  "capital": 25000,
  "atmIvTermDays": 7,
  "marginMode": "PM",
  "maxImrPctEntry": 50,
  "deltaHedge": { "enabled": false, "band": 0.1 },
  "legs": [
    { "type": "perp",   "side": "BUY",  "strikeMode": "atm", "strikeParam": 0, "dteTarget": 0, "size": 1.0, "sizeMode": "pct_capital" },
    { "type": "option", "side": "SELL", "optionType": "CALL", "strikeMode": "delta", "strikeParam": 0.30, "dteTarget": 14, "size": 1.0, "sizeMode": "pct_capital" }
  ],
  "entry": {
    "frequency": 336,
    "gateMode": "all",
    "gateMin": 1,
    "rvPctile":    { "enabled": false, "op": ">", "value": 50, "window": 168 },
    "ivPctile":    { "enabled": true,  "op": ">", "value": 55, "window": 720 },
    "rsi":         { "enabled": false, "op": "<", "value": 70 },
    "sma":         { "enabled": true,  "op": "above", "period": 336 },
    "fundingRate": { "enabled": false, "op": ">", "value": 0.01 }
  },
  "exit": {
    "gateMode": "any",
    "gateMin": 1,
    "profitTarget": { "enabled": true,  "value": 70 },
    "stopLoss":     { "enabled": true,  "value": 120 },
    "ivPctile":     { "enabled": false, "op": ">", "value": 80, "window": 720 },
    "dteFloor":     { "enabled": true,  "value": 1 },
    "maxHold":      { "enabled": false, "value": 336 },
    "distToLiq":    { "enabled": false, "value": 10 }
  },
  "backtest": { "startDate": "2026-01-01", "endDate": "2026-04-27" }
}
