{
  "name": "iron_condor_btc_14d",
  "underlying": "BTC",
  "capital": 100000,
  "atmIvTermDays": 7,
  "riskFreeRate": 0.05,
  "marginMode": "PM",
  "maxImrPctEntry": 70,
  "deltaHedge": { "enabled": false, "band": 0.1 },
  "legs": [
    { "type": "option", "side": "SELL", "optionType": "CALL", "strikeMode": "delta", "strikeParam": 0.25, "dteTarget": 14, "size": 1.0, "sizeMode": "contracts" },
    { "type": "option", "side": "BUY",  "optionType": "CALL", "strikeMode": "delta", "strikeParam": 0.10, "dteTarget": 14, "size": 1.0, "sizeMode": "contracts" },
    { "type": "option", "side": "SELL", "optionType": "PUT",  "strikeMode": "delta", "strikeParam": 0.25, "dteTarget": 14, "size": 1.0, "sizeMode": "contracts" },
    { "type": "option", "side": "BUY",  "optionType": "PUT",  "strikeMode": "delta", "strikeParam": 0.10, "dteTarget": 14, "size": 1.0, "sizeMode": "contracts" }
  ],
  "entry": {
    "frequency": 168,
    "gateMode": "all",
    "gateMin": 2,
    "rvPctile":    { "enabled": false, "op": ">", "value": 50, "window": 168 },
    "ivPctile":    { "enabled": true,  "op": ">", "value": 55, "window": 720 },
    "rsi":         { "enabled": false, "op": "<", "value": 70 },
    "sma":         { "enabled": false, "op": "above", "period": 168 },
    "fundingRate": { "enabled": false, "op": ">", "value": 0.01 }
  },
  "exit": {
    "gateMode": "any",
    "gateMin": 2,
    "profitTarget": { "enabled": true,  "value": 50  },
    "stopLoss":     { "enabled": true,  "value": 100 },
    "ivPctile":     { "enabled": false, "op": ">", "value": 80, "window": 720 },
    "dteFloor":     { "enabled": true,  "value": 1 },
    "maxHold":      { "enabled": false, "value": 336 },
    "distToLiq":    { "enabled": false, "value": 10 }
  },
  "backtest": { "startDate": "2026-01-01", "endDate": "2026-04-27" }
}
